{
  "version": 1,
  "sections": [
    {
      "id": "platform",
      "title": "Platform",
      "description": "Core provider and capability detection settings."
    },
    {
      "id": "policy",
      "title": "Policy Profile",
      "description": "Repository governance strictness and approval behavior."
    },
    {
      "id": "branching",
      "title": "Branching",
      "description": "Topology, branch graph, and reviewer thresholds."
    },
    {
      "id": "ci",
      "title": "CI/CD",
      "description": "Two-lane execution, risk classification, and required checks."
    },
    {
      "id": "deployments",
      "title": "Deployments",
      "description": "Components, environments, and approval matrix."
    },
    {
      "id": "planning",
      "title": "Planning Gates",
      "description": "Plan requirement policy and controlled automation bypasses."
    },
    {
      "id": "security",
      "title": "Security",
      "description": "Security scanning defaults and dependency policy behavior."
    },
    {
      "id": "updates",
      "title": "Upgrades",
      "description": "Release channel and apply mode behavior."
    },
    {
      "id": "modules",
      "title": "Modules",
      "description": "Enabled baseline modules and extension model."
    }
  ],
  "fields": {
    "version": {
      "section": "platform",
      "what_this_controls": "Schema version for baseline configuration.",
      "why_it_matters": "Defines backward compatibility behavior for migrations and validators.",
      "default_behavior": "Defaults to 1.",
      "tradeoffs": "Newer schema versions may expose more features but can require migration.",
      "prerequisites": "None.",
      "apply_impact": "Used by upgrade/validation runtime.",
      "fallback_or_remediation": "If schema mismatch is detected, run baseline upgrade to migrate safely."
    },
    "platform.provider": {
      "section": "platform",
      "what_this_controls": "Selects the baseline provider adapter used for capability probing and workflow generation.",
      "why_it_matters": "Provider adapters control which automation APIs are used and which governance features can be enforced.",
      "default_behavior": "Defaults to github.",
      "tradeoffs": "GitHub-first ships fastest and most robustly now; multi-provider adapters can be added later as modules.",
      "prerequisites": "A reachable GitHub repository and auth token for capability probing.",
      "apply_impact": "Regenerates provider-specific workflows and capability snapshots.",
      "fallback_or_remediation": "Unsupported provider values are rejected by schema validation."
    },
    "policy.profile": {
      "section": "policy",
      "what_this_controls": "Controls global enforcement strength across planning, CI, and approval gates.",
      "why_it_matters": "Determines whether checks block merges or run as advisory-only.",
      "default_behavior": "Defaults to strict.",
      "tradeoffs": "Strict increases control and safety; moderate/advisory increase delivery speed.",
      "prerequisites": "None.",
      "apply_impact": "Updates PR gate behavior, required checks, and reviewer threshold defaults.",
      "fallback_or_remediation": "If unsupported capabilities exist, strict policies degrade with visible warnings."
    },
    "policy.require_github_app": {
      "section": "policy",
      "what_this_controls": "Forces App-based auth for selected automation flows.",
      "why_it_matters": "Some org-wide and cross-repo operations need permissions beyond GITHUB_TOKEN.",
      "default_behavior": "False by default; App required only when enabled features need it.",
      "tradeoffs": "Requiring an App improves permission governance but adds setup overhead.",
      "prerequisites": "Installed GitHub App with required scopes.",
      "apply_impact": "Can block apply/upgrade when required capabilities are missing.",
      "fallback_or_remediation": "Install a GitHub App with required permissions or disable App-required enforcement."
    },
    "policy.enforce_codeowners_protected_paths": {
      "section": "policy",
      "what_this_controls": "Enables CODEOWNERS-path enforcement in large-team governance defaults.",
      "why_it_matters": "Protects critical paths with domain reviewer ownership in high-collaboration repos.",
      "default_behavior": "Enabled by default.",
      "tradeoffs": "Improves control but can increase review overhead.",
      "prerequisites": "CODEOWNERS file and branch protection/ruleset support.",
      "apply_impact": "Influences generated reviewer and branch policy artifacts.",
      "fallback_or_remediation": "If rulesets are unavailable, policy remains documented as advisory in generated outputs."
    },
    "branching.topology": {
      "section": "branching",
      "what_this_controls": "Selects branch model preset or custom mode.",
      "why_it_matters": "Defines merge flows, protection rules, and release promotion paths.",
      "default_behavior": "Defaults to two_branch (dev -> main).",
      "tradeoffs": "Presets are fast and safer; custom is flexible but requires more policy tuning.",
      "prerequisites": "Branch names configured in repository.",
      "apply_impact": "Regenerates branch topology policy and required-check target mappings.",
      "fallback_or_remediation": "Choose a preset topology when custom graph settings become inconsistent."
    },
    "branching.branches": {
      "section": "branching",
      "what_this_controls": "Custom branch graph entries with role and source-branch policy.",
      "why_it_matters": "Controls which branches are protected and how code promotion flows across environments.",
      "default_behavior": "Generated from selected topology preset.",
      "tradeoffs": "Highly flexible but requires careful policy review.",
      "prerequisites": "Consistent branch naming conventions.",
      "apply_impact": "Directly changes branch-role policy outputs and required checks per branch.",
      "fallback_or_remediation": "Use topology preset regeneration if custom graph drifts from required release model."
    },
    "branching.review_thresholds": {
      "section": "branching",
      "what_this_controls": "Defines required non-author approvals by maintainer-count buckets.",
      "why_it_matters": "Ensures solo/small/large teams get appropriate review gates without hardcoding.",
      "default_behavior": "Adaptive defaults: <=1 maintainer = 0 approvals, 2-5 = 1, >=6 = 2 + CODEOWNERS.",
      "tradeoffs": "Higher thresholds improve change control and reduce merge speed.",
      "prerequisites": "Maintainer detection or manual override.",
      "apply_impact": "Updates reviewer policy outputs and protection recommendations.",
      "fallback_or_remediation": "If collaborator probing is limited, conservative reviewer defaults are used."
    },
    "ci.mode": {
      "section": "ci",
      "what_this_controls": "Selects CI execution lane strategy.",
      "why_it_matters": "Balances fast feedback with full verification coverage.",
      "default_behavior": "Defaults to two_lane.",
      "tradeoffs": "Always-full is safest but slowest; lightweight is fastest but riskier.",
      "prerequisites": "None.",
      "apply_impact": "Regenerates PR gate workflow behavior and trigger rules.",
      "fallback_or_remediation": "When merge queue support is unavailable, classifier still enforces full lane for risky changes."
    },
    "ci.change_profiles": {
      "section": "ci",
      "what_this_controls": "Regex-based change routing for fast lane vs full lane.",
      "why_it_matters": "Avoids costly full runs on low-risk changes while preserving strict checks for risky paths.",
      "default_behavior": "Includes docs, ci, and app profiles by default.",
      "tradeoffs": "Overly broad rules can skip needed checks; overly strict rules increase CI cost.",
      "prerequisites": "Repository path conventions.",
      "apply_impact": "Updates generated classifier config consumed by PR gate workflow.",
      "fallback_or_remediation": "If profile regexes are invalid, baseline falls back to conservative full-lane behavior."
    },
    "ci.full_lane_triggers": {
      "section": "ci",
      "what_this_controls": "Defines explicit triggers for full lane execution (labels, merge queue, manual, path triggers).",
      "why_it_matters": "Guarantees high-signal checks run for critical flows even if classifier returns low risk.",
      "default_behavior": "Merge queue + manual + policy path triggers enabled.",
      "tradeoffs": "More triggers increase confidence but can reduce CI throughput.",
      "prerequisites": "Pull request labels and workflow permissions.",
      "apply_impact": "Updates classifier and PR gate workflow conditions.",
      "fallback_or_remediation": "Disable unsupported trigger types and rely on path/profile risk rules."
    },
    "deployments.environments": {
      "section": "deployments",
      "what_this_controls": "Environment list and role mapping used in deployment policies.",
      "why_it_matters": "Defines release promotion targets and branch-role eligibility.",
      "default_behavior": "Defaults to dev, staging, production.",
      "tradeoffs": "More environments increase control and complexity.",
      "prerequisites": "GitHub environments support when enforcing approvals.",
      "apply_impact": "Regenerates deployment workflows and approval matrix policies.",
      "fallback_or_remediation": "If environments API is unsupported, approval requirements remain documented and surfaced."
    },
    "deployments.components": {
      "section": "deployments",
      "what_this_controls": "Component catalog for per-component deployment and approval rules.",
      "why_it_matters": "Allows stricter controls for sensitive components while keeping low-risk components fast.",
      "default_behavior": "Auto-detected and editable.",